experiment_id,task,dataset,seed,model_summary,optimizer,lr,epochs_trained,best_val_accuracy,test_accuracy,precision,recall,mean_iou,notes
C1,classification,STL10,42,SimpleCNN (3 conv blocks + AdaptiveAvgPool + 2 linear; 620362 params),Adam,1e-3,15,0.598,,,,,без аугментаций
C2,classification,STL10,42,SimpleCNN (3 conv blocks + AdaptiveAvgPool + 2 linear; 620362 params),Adam,1e-3,15,0.613,,,,,с аугментациями (HFlip + RandomCrop + ColorJitter)
C3,classification,STL10,42,ResNet18 pretrained head-only (fc; 5130 trainable params),Adam,1e-3,10,0.942,,,,,backbone заморожен
C4,classification,STL10,42,ResNet18 pretrained finetune layer4+fc (8398858 trainable params),Adam,1e-4/1e-3,10,0.948,0.9449,,,,backbone lr=1e-4 head lr=1e-3; weight_decay=1e-4
V1,segmentation,OxfordIIITPet,42,DeepLabV3_ResNet50 (COCO_WITH_VOC_LABELS_V1; inference only),—,—,0,,,0.7355,0.988,0.7279,базовая постобработка (argmax → бинарная маска cat|dog)
V2,segmentation,OxfordIIITPet,42,DeepLabV3_ResNet50 (COCO_WITH_VOC_LABELS_V1; inference only),—,—,0,,,0.7357,0.988,0.7281,удаление малых связных компонент (< 500 px)
